{
    "source": 1,
    "id": "base:main",
    "name": "Base Source",
    "description": "Base source material. All other sources should depend on this",
    "lib": true,
    "definitions": {
        "pages": {
            "character": {
                "name": "Character Info"
            }
        }
    },
    "version": "sha256:57b0b4d0fc3d0833a21b865b2af96bae3ab3480d55a02affffa7f749e26105cc"
}